ID_Denuncia,FechaDenuncia,HoraDenuncia,TipoRobo,ZonaHecho,NombreDenunciante,EdadDenunciante,GeneroDenunciante,DescripcionHecho,MedioPrueba,UnidadInvestigacion,EstadoCaso,SospechosoIdentificado,MontoEstimadoPerdido,ReincidenciaZona
FELCC-02230,2025-05-07,12:12:05,Robo en vía pública,El Alto 1ra,Aitana Llanos Ruano,70,Masculino,"In id facilis fugiat. Veniam ad consectetur.
Cum tenetur numquam unde. Maiores culpa et accusantium vero accusantium molestias. Quasi laborum temporibus ex iusto doloribus.",Reconocimiento visual,División Cibercrimen,En investigación,No,26755,Alta
FELCC-02231,2025-05-07,20:42:28,Robo en vía pública,Zona Sur,Prudencio Antúnez Tomas,62,Masculino,"Consequuntur natus quos sunt praesentium nihil cum. Atque libero maxime. Voluptatem tenetur culpa.
Accusamus ipsum sint dicta. Autem optio magnam nisi voluptas.",Testigos,División Cibercrimen,Sin pistas,Sí,33047,Baja
FELCC-02232,2025-05-07,23:43:46,Robo domiciliario,Miraflores,Concepción Laguna Pombo,72,Femenino,Iste modi magnam magni culpa. Illo amet eaque repellendus totam. Tempora explicabo quod. Odio minima nemo possimus.,Ninguno,Unidad de Delitos Contra la Propiedad,Derivado a fiscalía,No,22535,Baja
FELCC-02233,2025-05-07,21:26:22,Robo en vía pública,El Alto 1ra,León Catalá Gimenez,72,Femenino,Illo quos quis magnam hic hic placeat. Ab quam porro eligendi numquam.,Ninguno,Unidad de Robo de Vehículos,Sin pistas,No,6704,Media
FELCC-02234,2025-05-07,18:24:34,Robo domiciliario,Villa El Carmen,María Belén Gonzalez Benavides,74,Masculino,Quia magnam ut quam repudiandae. Dolor repudiandae numquam aliquam.,Reconocimiento visual,Unidad de Robo de Vehículos,En investigación,No,12255,Alta
FELCC-02235,2025-05-07,01:00:30,Robo a comercio,Zona Sur,Julie Losa Beltrán,22,Masculino,Quam ullam reiciendis. Omnis repellendus ullam temporibus vel. Veniam amet provident nulla temporibus aspernatur.,Huella digital,Unidad de Robo de Vehículos,Con detenido,Sí,31904,Baja
FELCC-02236,2025-05-07,01:21:41,Robo de vehículo,Sopocachi,Josep Cózar Alemany,30,Masculino,Quasi debitis nobis nulla. Natus ducimus commodi rem soluta quos maiores. Quidem velit cumque sed debitis officiis atque sed.,Reconocimiento visual,Unidad de Delitos Contra la Propiedad,Derivado a fiscalía,No,27276,Baja
FELCC-02237,2025-05-07,08:22:39,Robo en vía pública,El Alto 1ra,Rafael Rodolfo Alberola Peñalver,33,Masculino,Labore at qui voluptatum debitis quis. Voluptas soluta eum distinctio consequuntur cum iusto. Ullam repellendus quisquam officiis.,Reconocimiento visual,Unidad de Delitos Contra la Propiedad,Sin pistas,No,18744,Alta
FELCC-02238,2025-05-07,17:15:50,Robo de vehículo,Zona Sur,Gabriel de Casado,29,Masculino,Perspiciatis quibusdam corporis sapiente iure velit. Aut quia tenetur rerum sit. Eos eius velit alias sint. Aspernatur nam ipsum nisi iure.,Testigos,Unidad de Delitos Contra la Propiedad,Cerrado,No,45247,Media
FELCC-02239,2025-05-07,02:39:21,Robo domiciliario,Miraflores,Edu Jordá Fiol,43,Femenino,"Repudiandae hic voluptatem quisquam.
Maiores assumenda mollitia omnis. Ratione laboriosam sed nobis. Earum voluptatibus repellat dolore maxime consectetur.",Testigos,Unidad de Delitos Contra la Propiedad,En investigación,Sí,7539,Baja
FELCC-02240,2025-05-07,18:13:35,Robo en vía pública,El Alto 1ra,Ariel Tur Arteaga,71,Femenino,"Hic asperiores optio. Placeat veritatis temporibus quasi placeat.
Aspernatur aliquid sunt aliquam. Soluta eaque sed saepe at autem tenetur. Quas dolore sed ipsum quae blanditiis.",Huella digital,Unidad de Delitos Contra la Propiedad,Derivado a fiscalía,Sí,32862,Baja
FELCC-02241,2025-05-07,08:24:11,Robo a comercio,Zona Sur,Gertrudis Rebeca Viñas Pellicer,27,Femenino,Ratione consequatur fugit rem deserunt. Nam doloribus odit.,Reconocimiento visual,Unidad de Robo de Vehículos,Con detenido,Sí,15045,Media
FELCC-02242,2025-05-07,08:14:42,Robo en vía pública,El Alto 1ra,Evangelina Jaume Vara,60,Femenino,Consequatur sunt qui. Porro cum in quo.,Cámara de seguridad,División Cibercrimen,En investigación,Sí,18728,Alta
FELCC-02243,2025-05-07,04:34:06,Robo a mano armada,El Alto 1ra,Adolfo Casals Nieto,48,Masculino,"Earum culpa eum maxime. Quos temporibus voluptatem aliquid laborum.
Aliquid facere officia. Provident voluptatem totam molestias sunt.",Cámara de seguridad,Unidad de Robo de Vehículos,Cerrado,Sí,40922,Media
FELCC-02244,2025-05-07,10:02:51,Robo domiciliario,Zona Sur,Victor Vargas-Mas,31,Masculino,"Quas delectus consequatur mollitia. Maxime sed architecto repudiandae saepe. Libero recusandae quaerat voluptas aliquid itaque repudiandae.
Ipsa tenetur repellendus dolorum vitae.",Ninguno,Unidad de Robo de Vehículos,En investigación,Sí,36856,Media
FELCC-02245,2025-05-07,22:34:15,Robo domiciliario,Sopocachi,Fulgencio Donoso Tello,70,Masculino,"Corrupti minima sed nesciunt aliquid. Fugiat occaecati quos incidunt officiis laboriosam commodi.
Recusandae numquam itaque voluptatem. Dicta deleniti facere quis magni aperiam.",Huella digital,Unidad de Robo de Vehículos,Derivado a fiscalía,No,16895,Media
FELCC-02246,2025-05-07,05:36:08,Robo a mano armada,Zona Sur,María Luisa Villar-Grande,72,Femenino,"Occaecati eaque placeat saepe.
Velit impedit consequatur distinctio. Eligendi nesciunt ex.
Quisquam earum laudantium est. Fuga dolores nemo.",Reconocimiento visual,Unidad de Delitos Contra la Propiedad,Cerrado,No,34259,Media
FELCC-02247,2025-05-07,14:28:48,Robo en vía pública,Centro La Paz,Abril Artigas Morcillo,18,Femenino,Totam consectetur reiciendis veritatis saepe. Sapiente doloribus dignissimos quam illo et. Incidunt facilis eligendi totam exercitationem.,Ninguno,Unidad de Robo de Vehículos,Cerrado,No,45110,Media
FELCC-02248,2025-05-07,22:06:40,Robo a mano armada,El Alto 1ra,Mamen Gomez Alcántara,24,Masculino,Sed magni nam delectus id officiis minus ducimus. Eum voluptatibus sed architecto necessitatibus dolor expedita corporis.,Cámara de seguridad,División Cibercrimen,Sin pistas,No,6996,Media
FELCC-02249,2025-05-07,16:20:41,Robo a comercio,El Alto 1ra,Tere Solís Ortuño,66,Femenino,Eveniet laudantium modi error deserunt voluptatum facilis eaque. Consequatur omnis pariatur pariatur aliquid quo.,Huella digital,Unidad de Robo de Vehículos,Con detenido,No,36788,Alta
FELCC-02250,2025-05-07,05:51:36,Robo a comercio,Villa El Carmen,Mar Ledesma Guillen,57,Masculino,"Error sint sint ex. Voluptatem labore nostrum illo optio voluptates cupiditate.
Voluptate placeat quas. Perspiciatis nisi reprehenderit.",Cámara de seguridad,Unidad de Delitos Contra la Propiedad,Cerrado,No,34739,Media
FELCC-02251,2025-05-07,06:52:19,Robo a mano armada,Sopocachi,Esmeralda Bauzà,52,Masculino,Voluptatibus animi tempore. Reprehenderit deserunt commodi odit vero.,Cámara de seguridad,División Cibercrimen,Con detenido,Sí,45417,Alta
FELCC-02252,2025-05-07,09:40:10,Robo a comercio,El Alto 1ra,Maricruz Mancebo Luís,29,Masculino,Laudantium odit quos laboriosam aliquid. Provident hic est modi. Soluta nam provident harum repudiandae.,Cámara de seguridad,Unidad de Robo de Vehículos,Cerrado,No,5442,Alta
FELCC-02253,2025-05-07,06:41:00,Robo a mano armada,El Alto 1ra,Aristides Ramón Calderón,72,Femenino,Libero omnis quia ex. Earum pariatur nulla nam libero. Labore aperiam nesciunt ducimus beatae eveniet.,Cámara de seguridad,Unidad de Robo de Vehículos,Con detenido,No,25477,Baja
FELCC-02254,2025-05-07,10:06:41,Robo de vehículo,Villa El Carmen,Pablo Criado Valverde,30,Masculino,Officiis eum pariatur earum itaque. Asperiores illo assumenda tenetur quae itaque corporis.,Testigos,Unidad de Robo de Vehículos,En investigación,Sí,34615,Baja
FELCC-02255,2025-05-07,11:13:13,Robo de vehículo,El Alto 1ra,Aarón Galindo Cornejo,21,Femenino,"Tenetur eius nobis aliquam aperiam nostrum voluptas. Rerum optio dicta officiis velit.
Neque ex consequuntur quae iusto nesciunt. Id itaque eos aliquam in.",Ninguno,División Cibercrimen,Derivado a fiscalía,No,3031,Baja
FELCC-02256,2025-05-07,12:50:24,Robo domiciliario,Miraflores,Paula Sanchez Lobo,21,Masculino,Commodi autem illo exercitationem suscipit. Quos earum esse alias. Id ut dicta.,Cámara de seguridad,Unidad de Delitos Contra la Propiedad,Derivado a fiscalía,Sí,46121,Baja
FELCC-02257,2025-05-07,23:41:42,Robo a comercio,Centro La Paz,Marina de Santana,34,Femenino,"Sequi cupiditate qui.
Esse sit tempora pariatur accusamus. Aperiam deserunt vitae tempora asperiores consequatur. Perferendis nihil iste sed optio saepe facere.",Reconocimiento visual,División Cibercrimen,Derivado a fiscalía,No,49003,Media
FELCC-02258,2025-05-07,06:45:12,Robo en vía pública,El Alto 1ra,Julia Roldán Buendía,66,Femenino,Beatae voluptas odio deleniti. Deleniti repellendus accusantium atque magni commodi cumque. Commodi reprehenderit nostrum veniam vitae eaque.,Huella digital,Unidad de Delitos Contra la Propiedad,Derivado a fiscalía,Sí,43118,Media
FELCC-02259,2025-05-07,04:03:42,Robo de vehículo,Zona Sur,Íngrid Pedrosa Alberola,65,Femenino,Ipsam laboriosam veniam ad laudantium tempora suscipit velit. Est consequatur neque nemo quidem. Accusamus et maxime mollitia ab.,Reconocimiento visual,Unidad de Delitos Contra la Propiedad,Derivado a fiscalía,No,48090,Alta
FELCC-02260,2025-05-07,15:18:18,Robo domiciliario,Centro La Paz,Cecilio Lloret Galan,59,Masculino,Facilis illum culpa quae explicabo eos. Dolorem fuga sit quisquam beatae commodi quo.,Testigos,División Cibercrimen,Sin pistas,No,27162,Alta
FELCC-02261,2025-05-07,04:13:32,Robo domiciliario,Centro La Paz,Brígida Paniagua Barros,23,Masculino,Iusto in iusto quibusdam vero non. Occaecati a alias ex earum sed nihil veniam.,Cámara de seguridad,División Cibercrimen,Cerrado,No,3033,Alta
FELCC-02262,2025-05-07,04:04:00,Robo en vía pública,Centro La Paz,Jessica Amat Macías,29,Masculino,Deserunt aspernatur nesciunt aliquam illum eveniet ipsa. Voluptate omnis repellendus est minus alias. Harum impedit temporibus ratione odio.,Huella digital,Unidad de Robo de Vehículos,Con detenido,Sí,13050,Media
FELCC-02263,2025-05-07,01:16:45,Robo domiciliario,Miraflores,Febe del Marcos,72,Masculino,Odit quasi beatae voluptatum nobis nemo blanditiis. Blanditiis explicabo ipsa excepturi. Nisi aliquid voluptate rem quam atque.,Ninguno,Unidad de Delitos Contra la Propiedad,En investigación,Sí,17011,Alta
FELCC-02264,2025-05-07,07:17:30,Robo en vía pública,Zona Sur,Jose Ramón Tena-Conde,63,Femenino,Tempora quam sunt repellendus qui. Mollitia doloribus ullam.,Cámara de seguridad,División Cibercrimen,En investigación,No,463,Alta
FELCC-02265,2025-05-07,07:17:11,Robo en vía pública,Villa El Carmen,Socorro Rocamora Conesa,74,Femenino,"Rem magni cumque adipisci consequatur. Dolore et quibusdam ratione ullam quia saepe vitae.
A laudantium iste voluptatum. Aliquam temporibus odio vel. Quia ullam hic culpa.",Testigos,Unidad de Robo de Vehículos,Sin pistas,Sí,8888,Alta
FELCC-02266,2025-05-07,23:53:33,Robo domiciliario,Sopocachi,Clarisa Adadia Andrade,64,Masculino,Ipsa ad ratione ullam fuga odio velit porro.,Cámara de seguridad,Unidad de Delitos Contra la Propiedad,Con detenido,No,38917,Media
FELCC-02267,2025-05-07,15:14:08,Robo a mano armada,Miraflores,Georgina Alberto Arranz,32,Femenino,Id omnis suscipit dolorem laudantium voluptatum. Similique recusandae blanditiis. Rem illo saepe nesciunt sit.,Cámara de seguridad,Unidad de Delitos Contra la Propiedad,Con detenido,Sí,17129,Baja
FELCC-02268,2025-05-07,09:35:37,Robo domiciliario,El Alto 1ra,Regina Jennifer Ripoll Anguita,72,Femenino,Pariatur inventore perferendis atque. Facilis expedita culpa. Deserunt blanditiis quia sed magnam non repudiandae debitis. Vero totam repellat animi minima cum.,Cámara de seguridad,Unidad de Robo de Vehículos,Sin pistas,No,30349,Media
FELCC-02269,2025-05-07,00:23:22,Robo a comercio,Centro La Paz,Juan Manuel Mancebo Torrents,29,Femenino,Voluptas incidunt nisi dolores dicta. Incidunt temporibus doloremque asperiores suscipit reprehenderit. Aperiam consectetur voluptate deleniti nihil consectetur odit.,Huella digital,División Cibercrimen,Cerrado,No,10445,Media
FELCC-02270,2025-05-07,17:27:52,Robo domiciliario,El Alto 1ra,Julio Bravo Rebollo,21,Masculino,Minus neque debitis veniam. Quidem provident eaque vero id. Labore vitae magni reprehenderit odit iure animi.,Cámara de seguridad,Unidad de Robo de Vehículos,Cerrado,No,22573,Alta
FELCC-02271,2025-05-07,20:48:40,Robo en vía pública,Centro La Paz,Carolina Paz Escolano,55,Masculino,Aperiam itaque sint quas reprehenderit. Ad odit sed. Incidunt earum laudantium fuga officiis veniam.,Ninguno,Unidad de Robo de Vehículos,Con detenido,No,41585,Media
FELCC-02272,2025-05-07,08:40:32,Robo domiciliario,Miraflores,Jose Ignacio Cabrero-Carnero,70,Masculino,"Molestiae debitis dolores doloremque repellendus. Deserunt inventore temporibus optio qui nobis omnis.
Odit rerum quos itaque. Eaque voluptates cupiditate nisi suscipit.",Ninguno,División Cibercrimen,En investigación,Sí,33512,Alta
FELCC-02273,2025-05-07,01:33:33,Robo domiciliario,Villa El Carmen,Maricruz Robles Lorenzo,71,Masculino,"Nostrum atque dolorem sint.
Hic et sunt ea rem minima aspernatur. Vel deleniti aspernatur eaque modi impedit ullam.",Testigos,Unidad de Delitos Contra la Propiedad,Con detenido,No,41997,Baja
FELCC-02274,2025-05-07,16:40:32,Robo de vehículo,Sopocachi,Úrsula Rovira-Quintanilla,53,Masculino,"Minima neque cupiditate neque inventore tempora.
Dolor error amet mollitia architecto. Neque voluptate laudantium minima. Eum iure nemo ullam omnis.",Testigos,Unidad de Robo de Vehículos,En investigación,Sí,36262,Media
FELCC-02275,2025-05-07,14:35:50,Robo domiciliario,Zona Sur,Andrea Abellán Ordóñez,73,Femenino,Praesentium ducimus earum et eligendi quod. Eius unde nemo error.,Cámara de seguridad,Unidad de Delitos Contra la Propiedad,En investigación,No,7922,Media
FELCC-02276,2025-05-07,12:07:26,Robo a comercio,Zona Sur,Berto Vallejo Llorente,34,Masculino,Quos explicabo neque eligendi aut. Ipsa necessitatibus doloribus itaque quidem atque neque. Praesentium eaque blanditiis.,Cámara de seguridad,División Cibercrimen,Con detenido,Sí,6804,Baja
FELCC-02277,2025-05-07,20:02:10,Robo de vehículo,Villa El Carmen,Nicodemo Jordán Fernandez,56,Masculino,"Eaque iste ducimus aliquam temporibus. Fugit eligendi quia accusantium iure.
Voluptatem velit voluptatem ipsum.
Rerum eius natus maxime enim eaque.",Ninguno,División Cibercrimen,Derivado a fiscalía,Sí,47536,Baja
FELCC-02278,2025-05-07,18:26:10,Robo en vía pública,El Alto 1ra,Azucena Carreras Becerra,71,Masculino,Ullam eveniet quidem modi. Provident impedit aut error sed beatae.,Testigos,División Cibercrimen,Cerrado,No,36002,Baja
FELCC-02279,2025-05-07,10:10:36,Robo a comercio,El Alto 1ra,Leopoldo Fabián Larrañaga Nicolau,64,Femenino,Occaecati optio non. Incidunt earum similique architecto reiciendis consequatur. Corrupti nihil asperiores eaque in ex reprehenderit atque.,Huella digital,División Cibercrimen,Cerrado,Sí,20853,Alta
FELCC-02280,2025-05-07,09:13:08,Robo de vehículo,Centro La Paz,Eliana Pozo Llobet,71,Femenino,"Asperiores sequi illum dolor dolorum. Cum minima eum possimus.
Dolore reiciendis illum numquam qui alias ex. Nulla ipsa blanditiis laborum impedit fugiat. Quidem veniam animi.",Huella digital,Unidad de Delitos Contra la Propiedad,En investigación,Sí,9854,Baja
FELCC-02281,2025-05-07,16:55:33,Robo de vehículo,Centro La Paz,Azucena de Cañizares,24,Masculino,Aspernatur vitae dolores maxime. Itaque ipsum possimus corporis harum praesentium cum. Eos inventore animi cumque nostrum nobis.,Reconocimiento visual,Unidad de Delitos Contra la Propiedad,Sin pistas,No,25822,Alta
FELCC-02282,2025-05-07,00:12:07,Robo en vía pública,Sopocachi,Magdalena Moraleda Alsina,55,Femenino,"Eaque aspernatur nisi consequuntur. Repudiandae sunt provident sint laboriosam in.
Minus vero labore vitae quasi nisi assumenda. Quisquam dolorem dolor corporis facilis tenetur.",Cámara de seguridad,Unidad de Robo de Vehículos,Cerrado,Sí,11238,Media
FELCC-02283,2025-05-07,07:35:42,Robo domiciliario,Centro La Paz,Guiomar del Jove,38,Masculino,Esse odio ducimus consequatur impedit molestias. Tenetur odio veniam ducimus amet. Qui quo deleniti doloremque ullam corrupti consectetur quas.,Testigos,División Cibercrimen,Derivado a fiscalía,Sí,49950,Alta
FELCC-02284,2025-05-07,08:26:06,Robo domiciliario,Villa El Carmen,Baldomero Huerta-Agustín,51,Femenino,Voluptate quidem optio blanditiis porro. Quibusdam ea repudiandae aliquid blanditiis minima. Maxime nulla earum.,Cámara de seguridad,Unidad de Robo de Vehículos,Con detenido,No,21696,Baja
FELCC-02285,2025-05-07,03:18:20,Robo a mano armada,Villa El Carmen,Carlota del Amor,71,Femenino,Tempore maxime doloremque asperiores. Nesciunt illo accusamus blanditiis numquam sapiente. Modi sint ex corrupti id recusandae.,Cámara de seguridad,División Cibercrimen,En investigación,No,29251,Alta
FELCC-02286,2025-05-07,13:39:41,Robo a comercio,Zona Sur,Ramón Olivares Ariño,58,Femenino,Aliquam maxime nostrum omnis assumenda unde. Exercitationem dolores provident laboriosam.,Ninguno,División Cibercrimen,Derivado a fiscalía,Sí,43851,Media
FELCC-02287,2025-05-07,04:18:57,Robo domiciliario,Sopocachi,Rosalía del Sarmiento,46,Masculino,Dicta distinctio quis cupiditate sit voluptatum. Ullam vero excepturi odio inventore. Consequatur tempore accusantium maiores officia porro commodi.,Huella digital,Unidad de Robo de Vehículos,Cerrado,Sí,17912,Media
FELCC-02288,2025-05-07,07:37:59,Robo domiciliario,El Alto 1ra,Celestino Font Zabala,50,Femenino,Repellat unde quis accusamus. Cumque voluptates debitis laborum.,Ninguno,División Cibercrimen,Sin pistas,Sí,41923,Media
FELCC-02289,2025-05-07,19:27:23,Robo a mano armada,Zona Sur,Alex de Millán,41,Masculino,"Corporis voluptatum aut nihil vitae provident ratione cumque. Fugiat magnam nihil sequi dolore eos.
Ratione alias ipsum repellendus asperiores dolor. Vitae occaecati ea itaque.",Ninguno,División Cibercrimen,Sin pistas,No,10637,Alta
FELCC-02290,2025-05-07,03:51:10,Robo domiciliario,Sopocachi,Isidora Pomares Roman,54,Femenino,Repellat deleniti mollitia impedit sapiente. Et porro reiciendis excepturi.,Cámara de seguridad,División Cibercrimen,Sin pistas,No,29524,Baja
FELCC-02291,2025-05-07,08:37:54,Robo domiciliario,El Alto 1ra,Fernando Ibán Landa Mariño,50,Femenino,Aliquid odit quibusdam. Distinctio expedita dicta odio praesentium. Hic ratione libero esse cumque.,Cámara de seguridad,División Cibercrimen,En investigación,No,35191,Media
FELCC-02292,2025-05-07,23:14:17,Robo de vehículo,El Alto 1ra,Fanny Guardia Izquierdo,64,Masculino,"Amet quis rerum repellat corporis.
Minus reiciendis ab assumenda quod sint nisi. Omnis dolorem nostrum qui tempore. Enim laborum aperiam.",Ninguno,División Cibercrimen,En investigación,Sí,7182,Media
FELCC-02293,2025-05-07,08:12:40,Robo a comercio,El Alto 1ra,Araceli del Zabala,27,Masculino,"Cumque harum enim nemo reiciendis. Quaerat libero explicabo.
Repellat velit eaque earum doloremque beatae. Voluptatem deleniti sequi sint. Eius consequatur consequatur neque eius.",Testigos,Unidad de Delitos Contra la Propiedad,Sin pistas,Sí,42907,Alta
FELCC-02294,2025-05-07,15:12:21,Robo de vehículo,Centro La Paz,Juliana Castilla Morcillo,51,Masculino,Reiciendis atque earum facilis. Magni praesentium occaecati asperiores. Animi fugit minus repellendus nesciunt. Inventore doloribus ad eos deleniti.,Reconocimiento visual,División Cibercrimen,Derivado a fiscalía,No,39422,Media
FELCC-02295,2025-05-07,13:32:43,Robo a comercio,Miraflores,Pía Heras,36,Masculino,Cumque at vel culpa delectus similique reprehenderit. Quidem est quam enim. Repudiandae asperiores eos optio quam fuga debitis illo.,Testigos,Unidad de Delitos Contra la Propiedad,En investigación,Sí,12046,Alta
FELCC-02296,2025-05-07,10:13:59,Robo domiciliario,El Alto 1ra,Ciríaco Valle Esteve,53,Femenino,Fugiat dolores officiis libero odit aliquam. Nesciunt dolor at corrupti. Veniam a dolores maiores quos nemo.,Cámara de seguridad,División Cibercrimen,Sin pistas,Sí,20261,Media
FELCC-02297,2025-05-07,23:13:20,Robo a comercio,Villa El Carmen,Claudio Guillermo Blasco Ramirez,65,Masculino,Eius molestiae fugit quod sit quisquam hic. Aperiam laboriosam repudiandae deserunt alias repudiandae vitae. Ex nulla suscipit incidunt.,Ninguno,Unidad de Robo de Vehículos,Con detenido,Sí,42693,Baja
FELCC-02298,2025-05-07,21:29:12,Robo de vehículo,Villa El Carmen,Anselma Collado Nicolau,68,Masculino,"Quam quasi nesciunt necessitatibus. Cumque accusamus molestiae quos cum.
Distinctio quia eius ullam. Sint corporis consequuntur. Culpa repellat eos veniam dolore eaque.",Reconocimiento visual,División Cibercrimen,Sin pistas,No,4170,Alta
FELCC-02299,2025-05-07,00:56:04,Robo a comercio,Zona Sur,Jose Carlos Perelló Pavón,64,Femenino,Laborum corrupti saepe doloremque pariatur accusantium excepturi. Vero animi vitae. Animi dolorem aut doloremque atque delectus vero.,Ninguno,Unidad de Delitos Contra la Propiedad,Cerrado,Sí,33039,Alta
FELCC-02300,2025-05-07,09:45:17,Robo a comercio,Villa El Carmen,Eufemia Moraleda-Domingo,67,Masculino,"Dolores alias eaque porro sapiente. Odit officia velit nam repellendus.
Vitae nulla distinctio cum quam. Qui enim iusto maiores.
Nobis magni dolor provident mollitia facilis quis.",Huella digital,Unidad de Robo de Vehículos,Sin pistas,Sí,3151,Media
FELCC-02301,2025-05-07,10:31:50,Robo domiciliario,Villa El Carmen,Reyes Molins Torre,26,Masculino,"Quasi animi nobis ullam porro. Incidunt neque rerum iste.
Accusamus adipisci itaque cupiditate. Iusto odio consequuntur tenetur.",Ninguno,División Cibercrimen,Sin pistas,No,40523,Media
FELCC-02302,2025-05-07,09:07:54,Robo en vía pública,Centro La Paz,Sandra Elías Amador,53,Femenino,Ex similique eum facilis. Perspiciatis qui excepturi blanditiis. Eum illum doloribus amet enim consectetur voluptatum. Sit doloribus explicabo quos maiores quo.,Ninguno,División Cibercrimen,En investigación,No,47406,Media
FELCC-02303,2025-05-07,01:28:08,Robo a mano armada,Miraflores,Valentina Lina Perez Comas,54,Masculino,Quasi minus iure reprehenderit sit facere.,Cámara de seguridad,Unidad de Robo de Vehículos,Con detenido,Sí,27987,Media
FELCC-02304,2025-05-07,02:20:46,Robo de vehículo,Villa El Carmen,Feliciano Franco Gallo,41,Masculino,Sunt similique est perferendis pariatur exercitationem officiis. Qui eos nesciunt excepturi.,Cámara de seguridad,Unidad de Delitos Contra la Propiedad,Cerrado,No,45676,Baja
FELCC-02305,2025-05-07,14:28:53,Robo en vía pública,Centro La Paz,Patricio Viña Azcona,45,Masculino,Nobis animi ut eligendi dicta tempore itaque. Ea occaecati facere voluptatibus. Eum quod nisi occaecati voluptas.,Testigos,Unidad de Robo de Vehículos,Con detenido,No,25889,Media
FELCC-02306,2025-05-07,19:25:32,Robo a mano armada,Centro La Paz,América Naranjo Parejo,28,Femenino,Quis reiciendis ipsum id nam sed. Quis excepturi aspernatur dolor veniam asperiores adipisci praesentium.,Reconocimiento visual,Unidad de Robo de Vehículos,En investigación,Sí,17340,Baja
FELCC-02307,2025-05-07,02:14:34,Robo a comercio,Villa El Carmen,Joaquín Benito,62,Femenino,Odit sed ut nam eius soluta eligendi. Explicabo accusantium ea tempore voluptate. Libero esse excepturi minima quasi delectus occaecati.,Cámara de seguridad,División Cibercrimen,Sin pistas,Sí,6893,Baja
FELCC-02308,2025-05-07,16:30:09,Robo a comercio,Villa El Carmen,Josefa Carmela Urrutia Durán,65,Femenino,"Quis libero aliquid quod perspiciatis nihil. Non vitae esse. Quod optio magnam asperiores. Nemo unde quasi odit.
In ipsam rerum. Quasi tenetur facere repellat ullam nostrum.",Huella digital,División Cibercrimen,Sin pistas,No,30952,Alta
FELCC-02309,2025-05-07,04:38:43,Robo domiciliario,Villa El Carmen,Ignacia Murillo Mariño,66,Femenino,Quibusdam aliquam qui tempora quibusdam. Laborum iusto illum unde deserunt. Maiores et sed iste eius et.,Huella digital,Unidad de Robo de Vehículos,Derivado a fiscalía,Sí,45117,Baja
FELCC-02310,2025-05-07,12:35:56,Robo a comercio,Miraflores,Baltasar Carreño Vall,48,Masculino,"Voluptas hic odit in quod similique vitae. Deleniti at mollitia quae totam nam reiciendis.
Molestias repellendus quas. Minima illum occaecati.",Reconocimiento visual,Unidad de Delitos Contra la Propiedad,Derivado a fiscalía,Sí,13774,Alta
FELCC-02311,2025-05-07,16:25:04,Robo a comercio,Miraflores,Custodia Cantero,64,Masculino,Fugit numquam in cum nostrum deserunt adipisci numquam. Est dolor ullam consectetur. Ducimus dicta amet quis.,Ninguno,División Cibercrimen,Con detenido,No,37690,Alta
FELCC-02312,2025-05-07,06:36:10,Robo a mano armada,Sopocachi,Feliciano Barco Oliva,52,Femenino,Suscipit aspernatur recusandae inventore excepturi. Iusto id voluptate. Amet aut voluptas doloremque laudantium vel.,Cámara de seguridad,Unidad de Delitos Contra la Propiedad,Sin pistas,No,1145,Alta
FELCC-02313,2025-05-07,14:13:48,Robo domiciliario,Zona Sur,Alex Valle Checa,23,Masculino,Veniam distinctio pariatur molestias. Consequatur cum ducimus occaecati ut. Possimus quas velit iure eius aspernatur.,Ninguno,División Cibercrimen,En investigación,Sí,31056,Baja
FELCC-02314,2025-05-07,19:34:50,Robo de vehículo,Centro La Paz,Ángel Prado Madrigal,37,Masculino,Voluptatem corporis enim vero architecto. Accusantium blanditiis ullam necessitatibus itaque non inventore iste. Quas placeat fuga molestias ea.,Ninguno,División Cibercrimen,Con detenido,No,21130,Media
FELCC-02315,2025-05-07,14:02:36,Robo domiciliario,Centro La Paz,Fabricio Lloret Villegas,20,Femenino,Nostrum recusandae eos non. Doloribus perferendis et quae. Nulla molestias nam cumque amet.,Testigos,División Cibercrimen,Derivado a fiscalía,No,36475,Media
FELCC-02316,2025-05-07,16:32:43,Robo domiciliario,Miraflores,Micaela Ariño,20,Femenino,Repellendus nam aliquid autem explicabo corporis possimus rem. At voluptatum voluptatem occaecati praesentium.,Testigos,División Cibercrimen,Con detenido,Sí,29219,Alta
