ID_Denuncia,FechaDenuncia,HoraDenuncia,TipoRobo,ZonaHecho,NombreDenunciante,EdadDenunciante,GeneroDenunciante,DescripcionHecho,MedioPrueba,UnidadInvestigacion,EstadoCaso,SospechosoIdentificado,MontoEstimadoPerdido,ReincidenciaZona
FELCC-00689,2025-05-07,02:21:38,Robo de vehículo,Villa El Carmen,Tere Beltran Sainz,40,Femenino,Culpa necessitatibus esse vel placeat distinctio doloribus. Fugit aperiam maxime debitis consequuntur temporibus earum. Neque sint numquam ratione architecto placeat.,Reconocimiento visual,Unidad de Delitos Contra la Propiedad,Con detenido,Sí,20563,Baja
FELCC-00690,2025-05-07,16:40:07,Robo a comercio,Sopocachi,Sebastián del Arroyo,42,Masculino,Suscipit ab illo rerum reprehenderit earum. Eveniet omnis dolorum blanditiis aliquid. Maiores iure quo repellendus.,Cámara de seguridad,Unidad de Delitos Contra la Propiedad,Sin pistas,Sí,8727,Baja
FELCC-00691,2025-05-07,18:24:26,Robo domiciliario,Miraflores,Lorenzo Ros Padilla,37,Femenino,Officiis id maxime quisquam omnis explicabo. Omnis fugiat excepturi esse inventore hic. Nobis porro voluptatibus itaque officia.,Cámara de seguridad,División Cibercrimen,Derivado a fiscalía,Sí,7177,Baja
FELCC-00692,2025-05-07,07:44:05,Robo a mano armada,Centro La Paz,Nadia Nicolasa Pascual Echeverría,29,Femenino,Minus odit praesentium nesciunt. Veniam adipisci sed nemo atque. Similique porro non dignissimos cupiditate natus soluta officiis. Deserunt aut voluptatum.,Reconocimiento visual,Unidad de Robo de Vehículos,En investigación,Sí,20382,Media
FELCC-00693,2025-05-07,08:35:50,Robo a mano armada,Sopocachi,Marcia de Gallego,42,Femenino,Qui rerum mollitia ex reprehenderit aut. Adipisci consequatur aperiam error omnis eius quidem nihil.,Testigos,División Cibercrimen,Cerrado,No,42414,Alta
FELCC-00694,2025-05-07,15:33:56,Robo domiciliario,Villa El Carmen,Cándido Riquelme Vélez,72,Femenino,"Neque quis magni quasi dicta sunt nemo. Molestiae commodi nisi quam. Commodi sapiente error labore magnam reprehenderit.
Occaecati numquam corporis.",Huella digital,Unidad de Delitos Contra la Propiedad,Cerrado,No,32228,Media
FELCC-00695,2025-05-07,06:45:24,Robo en vía pública,El Alto 1ra,Mamen Casal Navas,51,Femenino,"Sint a quis soluta nesciunt magnam dicta. Dolorem fugiat quis aliquid blanditiis. Maiores fugit laborum.
Mollitia rem architecto minima in. Nobis iusto itaque incidunt debitis.",Huella digital,Unidad de Robo de Vehículos,En investigación,No,5767,Media
FELCC-00696,2025-05-07,22:35:32,Robo en vía pública,Centro La Paz,Pánfilo Manrique-Guerrero,69,Femenino,Amet eveniet ipsum nisi minima adipisci. Illum quaerat officia fugit incidunt magnam.,Reconocimiento visual,División Cibercrimen,En investigación,No,37104,Media
FELCC-00697,2025-05-07,12:33:21,Robo a comercio,Miraflores,Maxi Arce Cisneros,58,Femenino,Sapiente aspernatur eveniet iusto modi hic cupiditate sint. Voluptatum voluptates occaecati quasi dolorum. Consequuntur accusantium debitis maxime sequi nobis.,Cámara de seguridad,Unidad de Robo de Vehículos,Derivado a fiscalía,No,20402,Media
FELCC-00698,2025-05-07,14:51:03,Robo domiciliario,El Alto 1ra,Remigio Valbuena Báez,25,Femenino,Illo fugit laborum hic vel explicabo voluptas eum. Necessitatibus corporis expedita consectetur.,Reconocimiento visual,Unidad de Robo de Vehículos,Sin pistas,Sí,41648,Alta
FELCC-00699,2025-05-07,12:56:29,Robo de vehículo,Miraflores,Lalo Maestre-Sanmartín,64,Masculino,"Ipsam dolorum nemo beatae eos culpa commodi. Eos excepturi asperiores quae mollitia nisi esse id. Dolorem dolorem porro incidunt.
Delectus dolorum quo tenetur.",Ninguno,División Cibercrimen,Derivado a fiscalía,Sí,26420,Alta
FELCC-00700,2025-05-07,20:47:58,Robo de vehículo,El Alto 1ra,Gala Araujo Casas,63,Femenino,Occaecati consectetur magni sit perspiciatis autem consectetur autem. Ipsa molestias explicabo debitis velit tempore sint. Nam optio quam consequuntur perspiciatis.,Testigos,Unidad de Delitos Contra la Propiedad,Derivado a fiscalía,Sí,30751,Alta
FELCC-00701,2025-05-07,05:57:29,Robo a mano armada,El Alto 1ra,Genoveva del Gras,52,Femenino,Sed velit ullam maxime natus rem minus. Fuga laudantium tempora veritatis. Consequuntur ut saepe dolores fugit.,Ninguno,Unidad de Delitos Contra la Propiedad,Cerrado,Sí,17326,Baja
FELCC-00702,2025-05-07,15:57:09,Robo domiciliario,Centro La Paz,Marcela Amor Torrijos,58,Femenino,Corrupti recusandae eos soluta repudiandae. Ea vitae quaerat nihil facilis atque.,Reconocimiento visual,Unidad de Delitos Contra la Propiedad,Sin pistas,Sí,44956,Media
FELCC-00703,2025-05-07,11:30:48,Robo a mano armada,Villa El Carmen,Aureliano Casals Fiol,72,Masculino,Itaque alias sint architecto quasi aliquid voluptatum. Ducimus voluptatibus natus quidem. Porro sunt porro nam magnam ad.,Ninguno,Unidad de Robo de Vehículos,Sin pistas,No,45957,Baja
FELCC-00704,2025-05-07,17:04:10,Robo a mano armada,Zona Sur,Brígida Soler Portillo,29,Femenino,Aut illo iusto. Assumenda mollitia nostrum rem provident. Ipsam minima perferendis odio tempora ex.,Testigos,Unidad de Delitos Contra la Propiedad,Derivado a fiscalía,Sí,7794,Baja
FELCC-00705,2025-05-07,00:03:44,Robo a comercio,Zona Sur,Nadia Gabaldón Caparrós,72,Masculino,Eum perspiciatis officiis veniam ducimus vel quaerat. Asperiores est fugit dolorum atque quo.,Testigos,Unidad de Delitos Contra la Propiedad,En investigación,No,40717,Media
FELCC-00706,2025-05-07,06:52:20,Robo de vehículo,Zona Sur,Irene Zapata Niño,55,Femenino,Dignissimos iusto earum eius saepe illum. Sint a laborum autem commodi.,Testigos,Unidad de Robo de Vehículos,En investigación,Sí,18314,Alta
FELCC-00707,2025-05-07,14:46:40,Robo de vehículo,Zona Sur,Emiliano Miguel Ángel Cámara Barreda,67,Femenino,Expedita aliquam soluta expedita harum tenetur. Id voluptates quis exercitationem.,Reconocimiento visual,Unidad de Delitos Contra la Propiedad,Cerrado,No,48740,Alta
FELCC-00708,2025-05-07,04:15:14,Robo domiciliario,Sopocachi,Olivia Diego Pinilla,23,Femenino,Maiores voluptates delectus doloremque. Cumque beatae dicta in necessitatibus fuga vel. Vitae sunt optio blanditiis.,Ninguno,Unidad de Robo de Vehículos,Derivado a fiscalía,No,29314,Media
FELCC-00709,2025-05-07,11:55:16,Robo a mano armada,Zona Sur,Carmelo Ramos-Espinosa,61,Masculino,"Voluptate ad provident tempora numquam omnis. Quod non maxime.
Ad omnis necessitatibus nulla eos inventore sequi. Ad praesentium corrupti ab aut. Architecto rerum rem molestias.",Cámara de seguridad,Unidad de Delitos Contra la Propiedad,Cerrado,No,20326,Media
FELCC-00710,2025-05-07,20:45:45,Robo de vehículo,Centro La Paz,Amarilis Barberá Alemany,72,Masculino,Sint quae ea voluptas molestias dolorem. Aliquid sequi minus sapiente fugiat. Odio fugiat est eaque totam impedit magnam. Velit dolor nesciunt molestiae ipsum quidem.,Testigos,Unidad de Delitos Contra la Propiedad,Derivado a fiscalía,Sí,44286,Baja
FELCC-00711,2025-05-07,13:11:00,Robo de vehículo,Miraflores,Reynaldo Portillo-Barceló,48,Femenino,Quidem nam praesentium voluptatem. Non architecto assumenda dolor cupiditate pariatur illum error.,Cámara de seguridad,División Cibercrimen,En investigación,No,605,Alta
FELCC-00712,2025-05-07,05:03:03,Robo domiciliario,Miraflores,José Manuel Manuel Daza Sosa,56,Masculino,Saepe velit voluptate. Porro cupiditate laboriosam laboriosam ducimus consequuntur voluptates beatae. Quas eum et.,Cámara de seguridad,Unidad de Delitos Contra la Propiedad,Sin pistas,Sí,28304,Media
FELCC-00713,2025-05-07,19:31:38,Robo de vehículo,Villa El Carmen,Rosalva Bravo Polo,53,Masculino,Delectus quis magni dolores sequi ducimus deleniti explicabo. Assumenda aliquid quisquam molestiae possimus.,Testigos,Unidad de Robo de Vehículos,Sin pistas,Sí,10321,Baja
FELCC-00714,2025-05-07,04:21:49,Robo a comercio,Miraflores,Joel Figuerola Cuervo,53,Masculino,Eligendi est similique occaecati fuga laborum illo. Iusto numquam repellat.,Cámara de seguridad,Unidad de Delitos Contra la Propiedad,Sin pistas,Sí,47405,Baja
FELCC-00715,2025-05-07,01:37:07,Robo domiciliario,Villa El Carmen,Anastasia Castellanos Alonso,55,Femenino,Explicabo reprehenderit laborum velit eum. Quasi quam quaerat assumenda omnis molestiae quisquam. Aspernatur consequuntur mollitia praesentium. Assumenda minus harum ipsam.,Cámara de seguridad,Unidad de Robo de Vehículos,Con detenido,Sí,14365,Media
FELCC-00716,2025-05-07,14:12:12,Robo en vía pública,Centro La Paz,Pascual José Luis Romero Carnero,64,Masculino,Laudantium totam assumenda eaque adipisci laudantium. Labore numquam totam sed facere est. Sint quisquam asperiores accusantium quos.,Huella digital,División Cibercrimen,Sin pistas,No,19008,Alta
FELCC-00717,2025-05-07,17:34:11,Robo en vía pública,Sopocachi,Aitor Álvarez-Peña,19,Femenino,Beatae mollitia earum quibusdam. Rerum maxime laborum at impedit laboriosam cupiditate perferendis.,Ninguno,División Cibercrimen,Sin pistas,Sí,9869,Baja
FELCC-00718,2025-05-07,18:05:10,Robo a comercio,Centro La Paz,Elena Frutos Balaguer,65,Masculino,"Necessitatibus sapiente mollitia. Et sequi velit occaecati accusantium asperiores.
Perferendis sequi illo asperiores voluptatum ratione eligendi.
Nam aut veniam cum earum.",Testigos,Unidad de Robo de Vehículos,En investigación,Sí,16291,Media
FELCC-00719,2025-05-07,07:19:37,Robo a comercio,Centro La Paz,Jerónimo Sotelo Moles,37,Femenino,Assumenda quidem tempore corrupti blanditiis corrupti. Amet quibusdam quas eius amet.,Huella digital,División Cibercrimen,Derivado a fiscalía,No,33612,Media
FELCC-00720,2025-05-07,08:27:32,Robo a comercio,Centro La Paz,Candelas Huguet Piña,26,Masculino,Occaecati tenetur aut repellendus neque quibusdam. Temporibus quis sapiente harum aut voluptate. Debitis doloribus explicabo ipsa sit dolore.,Testigos,Unidad de Delitos Contra la Propiedad,Derivado a fiscalía,No,42815,Media
FELCC-00721,2025-05-07,16:42:28,Robo en vía pública,Villa El Carmen,Zaira Cózar Balaguer,71,Masculino,Iusto officiis quisquam quos aliquid quo. Error autem iure architecto quos. Impedit iste excepturi sapiente consequuntur dolores ea cum.,Cámara de seguridad,Unidad de Delitos Contra la Propiedad,Derivado a fiscalía,No,6065,Alta
FELCC-00722,2025-05-07,13:32:34,Robo a mano armada,Villa El Carmen,Borja Alcolea-Marín,58,Masculino,Velit maiores perferendis neque animi voluptas dignissimos optio. Nemo quisquam recusandae magni quam ex.,Huella digital,Unidad de Delitos Contra la Propiedad,Cerrado,No,49894,Baja
FELCC-00723,2025-05-07,05:11:45,Robo a mano armada,Zona Sur,Baudelio Antúnez Hierro,70,Masculino,"Tempora est eius amet. Libero in fugiat officia.
Quod ex molestiae culpa magni sit. Minus doloremque aut dolores magni porro. Labore vitae tenetur vero natus.",Reconocimiento visual,División Cibercrimen,Derivado a fiscalía,Sí,1696,Media
FELCC-00724,2025-05-07,21:58:49,Robo domiciliario,Villa El Carmen,Dolores de Vega,25,Femenino,Culpa omnis consequatur rerum veritatis modi. Reprehenderit at occaecati quod a expedita.,Reconocimiento visual,División Cibercrimen,En investigación,No,6776,Alta
FELCC-00725,2025-05-07,11:21:49,Robo de vehículo,Sopocachi,José Mari del Alcalá,49,Masculino,"Illo suscipit rem. Quo illum aliquid error assumenda.
Nemo tempore unde facere doloribus. Fugit illum exercitationem voluptatum. Esse odio omnis numquam itaque enim.",Testigos,Unidad de Robo de Vehículos,En investigación,Sí,26328,Media
FELCC-00726,2025-05-07,13:01:32,Robo de vehículo,Centro La Paz,Silvio Toro,54,Masculino,"Possimus quae illum. Nobis quidem maiores. Possimus ea deserunt.
Suscipit a labore. Nostrum quis dolores voluptatibus aliquid. Perspiciatis dolor molestiae dignissimos.",Reconocimiento visual,Unidad de Robo de Vehículos,Sin pistas,Sí,9379,Media
FELCC-00727,2025-05-07,02:55:11,Robo en vía pública,Villa El Carmen,Curro Gual Blanes,21,Femenino,Placeat ea maxime voluptatem. Ab dignissimos maxime debitis dicta nihil.,Ninguno,Unidad de Delitos Contra la Propiedad,Con detenido,Sí,14723,Baja
FELCC-00728,2025-05-07,21:33:26,Robo domiciliario,Sopocachi,Cruz Salas Blázquez,66,Femenino,"Nisi ut delectus odit. Quasi vero est molestias officia excepturi amet.
Rerum minima similique illo nulla. Saepe quae perspiciatis sint.",Cámara de seguridad,Unidad de Delitos Contra la Propiedad,Derivado a fiscalía,No,9482,Media
FELCC-00729,2025-05-07,04:49:44,Robo a comercio,Centro La Paz,Guadalupe Tello Huertas,64,Masculino,Officia eligendi soluta saepe quos placeat ipsa. Non deleniti quas dolorem pariatur animi similique. Ipsam laboriosam quaerat.,Testigos,Unidad de Robo de Vehículos,Derivado a fiscalía,No,34707,Media
FELCC-00730,2025-05-07,01:24:00,Robo a mano armada,Miraflores,Javi Ródenas,30,Femenino,Natus repellendus totam blanditiis temporibus. Excepturi nam sapiente mollitia quos quasi occaecati nam.,Cámara de seguridad,Unidad de Robo de Vehículos,En investigación,No,6204,Media
FELCC-00731,2025-05-07,05:06:45,Robo domiciliario,Villa El Carmen,Rogelio del Saavedra,59,Femenino,Placeat facilis qui. Laboriosam expedita sapiente autem aut cum delectus. Maiores fugit deserunt blanditiis necessitatibus esse voluptas.,Testigos,Unidad de Delitos Contra la Propiedad,Derivado a fiscalía,No,33416,Media
FELCC-00732,2025-05-07,13:59:39,Robo a comercio,El Alto 1ra,Aarón Pozo Viñas,40,Femenino,"Eligendi modi voluptatem possimus. Asperiores nesciunt eum tempora ut consequuntur.
Ut suscipit quis et beatae incidunt. Eveniet cupiditate similique quasi. Eos delectus quis.",Cámara de seguridad,Unidad de Robo de Vehículos,Derivado a fiscalía,Sí,28981,Media
FELCC-00733,2025-05-07,15:15:03,Robo en vía pública,Sopocachi,Leonardo Tenorio Molins,52,Femenino,"Nemo itaque vero voluptate dolor ut. Quaerat nulla inventore dignissimos veritatis distinctio.
Aut quasi quibusdam tempora earum odit itaque. Impedit dolor veniam cumque soluta.",Ninguno,División Cibercrimen,Sin pistas,Sí,586,Media
FELCC-00734,2025-05-07,10:45:33,Robo en vía pública,Miraflores,Adolfo Seco Escribano,22,Femenino,Inventore libero nobis vero excepturi quasi. Est aliquid praesentium repellat. Velit saepe voluptates.,Reconocimiento visual,Unidad de Robo de Vehículos,Con detenido,Sí,25298,Media
FELCC-00735,2025-05-07,06:46:29,Robo a comercio,Centro La Paz,Chus Arrieta Arias,40,Femenino,"Nobis iusto repellat occaecati natus praesentium.
Tempora accusamus aut numquam rerum. Eum necessitatibus nihil voluptates. Eveniet nemo vel.",Testigos,Unidad de Delitos Contra la Propiedad,Derivado a fiscalía,No,35506,Alta
FELCC-00736,2025-05-07,14:39:24,Robo a comercio,Miraflores,Juan Francisco Carbajo Solís,54,Masculino,"Quam natus nobis sed atque quibusdam. Adipisci aut laboriosam aperiam explicabo. Non perspiciatis earum ipsa harum nemo.
Debitis id provident accusamus libero.",Huella digital,Unidad de Robo de Vehículos,Con detenido,No,17319,Media
FELCC-00737,2025-05-07,06:45:16,Robo a mano armada,Miraflores,Edmundo Elorza Feliu,42,Masculino,Quos dolores doloremque officiis autem ducimus minima. Hic molestias cumque. A hic occaecati. Eos eum quo saepe incidunt alias.,Ninguno,Unidad de Delitos Contra la Propiedad,Sin pistas,Sí,11286,Alta
FELCC-00738,2025-05-07,05:18:06,Robo en vía pública,Miraflores,Alexandra Etelvina Peláez Echeverría,36,Masculino,"In labore quod consequatur.
Quae dolore ullam pariatur laborum ipsum recusandae. Nisi provident recusandae temporibus.",Ninguno,Unidad de Delitos Contra la Propiedad,Con detenido,Sí,33822,Media
FELCC-00739,2025-05-07,12:32:06,Robo domiciliario,Centro La Paz,Dominga Lerma-Lozano,69,Femenino,Totam vero error laborum excepturi porro eligendi. Eum veniam amet nam voluptas quo.,Cámara de seguridad,Unidad de Delitos Contra la Propiedad,Con detenido,Sí,6854,Media
FELCC-00740,2025-05-07,17:34:02,Robo de vehículo,Sopocachi,Francisco Javier Vicens Vargas,19,Femenino,"Natus libero ea magni excepturi dolores aliquid provident.
Explicabo voluptas earum laborum fuga repellat. Eum omnis neque.
Dicta nam sunt harum iure.",Huella digital,División Cibercrimen,Cerrado,No,37047,Media
FELCC-00741,2025-05-07,07:19:47,Robo a mano armada,Villa El Carmen,Jimena Encarnacion Sanabria Giménez,21,Masculino,Sapiente id odio ipsa esse reiciendis temporibus doloremque. Iste repellat earum dicta rerum necessitatibus. Magni harum ea dolor.,Reconocimiento visual,División Cibercrimen,Sin pistas,No,33551,Media
FELCC-00742,2025-05-07,06:23:34,Robo en vía pública,El Alto 1ra,María Pilar Colomer-Jaume,38,Masculino,"Facere expedita aspernatur nobis. Enim iusto aut necessitatibus iure. Corporis facilis illum voluptate vero nobis eligendi.
Nisi repellendus vitae velit blanditiis.",Cámara de seguridad,Unidad de Delitos Contra la Propiedad,Con detenido,No,47230,Alta
FELCC-00743,2025-05-07,04:56:42,Robo a mano armada,Miraflores,Amelia Lobo Sanjuan,37,Femenino,Commodi voluptatibus hic dolores enim tempora ipsa reprehenderit. Esse provident similique repellat illum eveniet magni.,Cámara de seguridad,División Cibercrimen,Derivado a fiscalía,No,11951,Alta
FELCC-00744,2025-05-07,23:18:05,Robo de vehículo,Villa El Carmen,Nicolasa Ricarda Mateo Morillo,61,Masculino,"Autem reiciendis nulla maxime laborum animi illo.
Ab deserunt ipsa in maiores laborum. Cumque quasi enim nihil amet ea non. Similique sit maxime veritatis maxime minus placeat.",Testigos,División Cibercrimen,Sin pistas,No,13836,Alta
FELCC-00745,2025-05-07,08:49:54,Robo de vehículo,Centro La Paz,Benjamín Trujillo Ordóñez,47,Masculino,Aliquid est voluptatibus molestiae deserunt recusandae. Quae excepturi nemo reiciendis itaque debitis. Labore deleniti eum deserunt.,Huella digital,Unidad de Delitos Contra la Propiedad,Con detenido,Sí,6456,Alta
FELCC-00746,2025-05-07,11:49:27,Robo domiciliario,Miraflores,Bartolomé Correa Becerra,31,Masculino,"Quia corporis doloremque quidem placeat.
Molestiae unde maxime atque consequuntur tempore.",Huella digital,División Cibercrimen,Derivado a fiscalía,Sí,36259,Media
FELCC-00747,2025-05-07,14:51:41,Robo domiciliario,Villa El Carmen,Almudena de Pujol,30,Masculino,Harum tempore repudiandae impedit dolores quasi. Provident qui voluptates voluptatem. Consequatur repudiandae quas explicabo labore non dolorum.,Huella digital,Unidad de Robo de Vehículos,Cerrado,No,31929,Alta
FELCC-00748,2025-05-07,05:56:04,Robo a comercio,Centro La Paz,Ruperta Dueñas Morera,24,Masculino,"Non qui illo atque earum. Veritatis aut et placeat.
Deleniti ad fugiat quibusdam cumque architecto eveniet. Amet beatae veritatis quo odit illum reiciendis.",Testigos,División Cibercrimen,En investigación,No,20009,Alta
FELCC-00749,2025-05-07,22:27:38,Robo en vía pública,El Alto 1ra,Graciana Isabela Aller Manso,41,Femenino,Delectus facere officia impedit aperiam dicta doloremque consequatur. Itaque esse unde saepe eum quo distinctio. Nisi quae atque quia praesentium.,Ninguno,Unidad de Delitos Contra la Propiedad,En investigación,Sí,33252,Alta
FELCC-00750,2025-05-07,09:43:46,Robo en vía pública,Villa El Carmen,Mauricio de Ordóñez,28,Masculino,Dolorum sapiente recusandae accusamus dolorum id porro. Consequuntur quasi debitis similique. Magnam labore nam exercitationem placeat quam praesentium iste.,Reconocimiento visual,Unidad de Robo de Vehículos,En investigación,No,48270,Alta
FELCC-00751,2025-05-07,09:12:01,Robo domiciliario,Miraflores,Elodia Llamas,70,Masculino,Aliquam aut assumenda laborum. Magni quibusdam non aliquam.,Reconocimiento visual,Unidad de Robo de Vehículos,Cerrado,No,38275,Baja
FELCC-00752,2025-05-07,11:09:25,Robo a comercio,Zona Sur,Aránzazu Merche Santana Borja,27,Masculino,"Doloremque iusto neque nam voluptatum fugiat quo.
Explicabo vitae atque. Temporibus ipsum quaerat quis illum repellat tenetur deleniti. Itaque molestias praesentium asperiores et.",Ninguno,Unidad de Delitos Contra la Propiedad,En investigación,Sí,15750,Alta
FELCC-00753,2025-05-07,08:39:57,Robo domiciliario,El Alto 1ra,Baudelio Pastor Borrás,61,Masculino,Delectus dolorem harum rem est natus est. Quam molestias ducimus quisquam assumenda doloribus.,Ninguno,Unidad de Delitos Contra la Propiedad,En investigación,No,18680,Media
FELCC-00754,2025-05-07,08:08:31,Robo a comercio,El Alto 1ra,Edelmiro Vicente Diaz,54,Femenino,"Reiciendis dicta ducimus cum laborum nobis dolore assumenda. Vitae perspiciatis pariatur dolorum.
Laboriosam cumque corrupti soluta neque. Soluta quisquam minus maiores.",Ninguno,Unidad de Robo de Vehículos,En investigación,Sí,9259,Media
FELCC-00755,2025-05-07,14:05:38,Robo a mano armada,Zona Sur,Ale Bonilla Gual,66,Masculino,Laborum impedit in quos officia adipisci nam. Quia cum neque doloremque quisquam. Nisi voluptatum enim. Itaque placeat sequi doloribus blanditiis dolores ipsa beatae.,Cámara de seguridad,Unidad de Delitos Contra la Propiedad,Sin pistas,Sí,19863,Media
FELCC-00756,2025-05-07,09:31:36,Robo en vía pública,El Alto 1ra,Jose Ignacio Cosme Zaragoza Rosales,59,Masculino,Voluptate perferendis blanditiis sunt ut sed. Aspernatur ratione beatae mollitia voluptatem. Officia laboriosam qui quas sapiente excepturi.,Ninguno,Unidad de Robo de Vehículos,Cerrado,No,5669,Media
FELCC-00757,2025-05-07,10:43:42,Robo domiciliario,Miraflores,Jovita del Ibarra,28,Femenino,Nisi quidem non labore maxime fugit quidem. Enim nesciunt ipsum architecto accusantium perferendis voluptate omnis.,Huella digital,Unidad de Robo de Vehículos,Sin pistas,No,49597,Baja
FELCC-00758,2025-05-07,04:33:18,Robo a comercio,Miraflores,Catalina Baquero Tirado,19,Masculino,Esse doloribus blanditiis tenetur recusandae praesentium ut neque. Facere voluptatum perspiciatis repellendus doloribus odit nesciunt illum.,Ninguno,Unidad de Robo de Vehículos,En investigación,Sí,4207,Media
FELCC-00759,2025-05-07,19:03:44,Robo a mano armada,El Alto 1ra,Haroldo Laguna Carrera,25,Femenino,Qui velit excepturi explicabo id temporibus tempore. Cumque optio quaerat quia. Qui porro tempore voluptatum.,Reconocimiento visual,División Cibercrimen,Con detenido,Sí,26373,Alta
FELCC-00760,2025-05-07,05:22:24,Robo a comercio,Sopocachi,Rosalva Pombo Roda,41,Femenino,Maxime voluptatem explicabo voluptatem consequatur quia exercitationem. Aliquid molestiae magni similique id repudiandae distinctio nemo. Minima occaecati tenetur inventore.,Huella digital,Unidad de Robo de Vehículos,Sin pistas,No,676,Media
FELCC-00761,2025-05-07,14:34:26,Robo en vía pública,El Alto 1ra,Fidela Marita Antón Gonzalo,70,Femenino,"Necessitatibus tenetur error quis. Adipisci consequatur suscipit eos omnis.
Adipisci corporis nisi iusto deserunt. Ipsum voluptatibus perspiciatis eligendi. Neque doloribus aut.",Ninguno,Unidad de Delitos Contra la Propiedad,Sin pistas,No,10374,Baja
FELCC-00762,2025-05-07,06:50:43,Robo a comercio,Villa El Carmen,Matías Gimeno Doménech,57,Femenino,Voluptates consequuntur laudantium. Autem totam animi.,Testigos,Unidad de Delitos Contra la Propiedad,Sin pistas,No,14336,Baja
FELCC-00763,2025-05-07,01:02:43,Robo de vehículo,El Alto 1ra,María Jesús Cazorla Madrid,21,Femenino,Voluptates id rem officia. Molestias illum consequuntur dignissimos.,Reconocimiento visual,División Cibercrimen,En investigación,No,20068,Baja
FELCC-00764,2025-05-07,07:01:29,Robo en vía pública,Centro La Paz,Roberta Iniesta Arenas,22,Masculino,Corporis consectetur id ea excepturi nobis. Eius excepturi aspernatur quia. Quibusdam corrupti omnis totam in nemo.,Testigos,Unidad de Robo de Vehículos,Sin pistas,No,2814,Baja
FELCC-00765,2025-05-07,22:30:38,Robo en vía pública,Villa El Carmen,Edmundo Franch Ferrándiz,68,Femenino,Ratione ducimus aspernatur nemo quam laborum sapiente. Doloremque vero unde atque nisi. Sunt repellendus explicabo debitis iste vero.,Cámara de seguridad,Unidad de Robo de Vehículos,En investigación,No,36726,Baja
FELCC-00766,2025-05-07,15:58:23,Robo a mano armada,Miraflores,Teófilo Pablo Villalobos,41,Masculino,Ullam id ducimus nostrum qui similique. Adipisci saepe dolore officia. Tenetur maxime illum. Pariatur quas provident quas vel.,Reconocimiento visual,Unidad de Robo de Vehículos,Derivado a fiscalía,No,33273,Alta
FELCC-00767,2025-05-07,03:24:53,Robo domiciliario,El Alto 1ra,Rosalinda María Manuela Zapata Barranco,51,Masculino,"Saepe modi nisi sunt. Ex repellendus eos minima.
Ipsa quasi cupiditate voluptate consequatur. Nam illo illo cupiditate.",Testigos,División Cibercrimen,Derivado a fiscalía,Sí,2304,Baja
FELCC-00768,2025-05-07,16:23:58,Robo domiciliario,Centro La Paz,Cornelio Mir,42,Femenino,Itaque impedit dolore veniam possimus neque impedit. Exercitationem nam ab ducimus maiores. Temporibus harum facilis iste error.,Testigos,Unidad de Delitos Contra la Propiedad,Con detenido,No,39193,Media
FELCC-00769,2025-05-07,16:54:14,Robo domiciliario,El Alto 1ra,Lino Ocaña Figueroa,27,Femenino,"Animi nihil nam velit. Maiores assumenda modi optio animi sapiente qui.
Quas quasi necessitatibus facilis doloribus. Perferendis voluptatibus nostrum rerum. Rerum inventore ex ex.",Reconocimiento visual,División Cibercrimen,Derivado a fiscalía,Sí,43251,Alta
FELCC-00770,2025-05-07,03:49:43,Robo a comercio,Centro La Paz,María Luisa Montalbán-Rosell,74,Masculino,Vel dolores ex id. Quam dicta et nisi nisi perspiciatis. Temporibus vel aliquid consequatur delectus porro.,Ninguno,Unidad de Robo de Vehículos,Derivado a fiscalía,No,21484,Baja
FELCC-00771,2025-05-07,21:49:42,Robo domiciliario,Centro La Paz,Amparo Puga Heras,28,Femenino,Quis dicta consequatur. Quisquam sit minus soluta sapiente. Nostrum debitis totam nemo.,Testigos,Unidad de Delitos Contra la Propiedad,Con detenido,Sí,12111,Media
FELCC-00772,2025-05-07,15:42:18,Robo de vehículo,Villa El Carmen,Ana Sofía Tomás Olivera,40,Masculino,"Autem iste dolores. Asperiores perspiciatis alias enim in.
Assumenda sed molestias expedita quo ab. Amet quibusdam maiores facilis.",Reconocimiento visual,Unidad de Delitos Contra la Propiedad,Cerrado,No,13835,Baja
