ID_Denuncia,FechaDenuncia,HoraDenuncia,TipoRobo,ZonaHecho,NombreDenunciante,EdadDenunciante,GeneroDenunciante,DescripcionHecho,MedioPrueba,UnidadInvestigacion,EstadoCaso,SospechosoIdentificado,MontoEstimadoPerdido,ReincidenciaZona
FELCC-01455,2025-05-07,10:06:11,Robo a mano armada,Centro La Paz,Clemente Ángel Español,33,Masculino,Ea sed amet saepe necessitatibus earum. Possimus tempore qui quis quae. Possimus velit neque autem fugiat distinctio.,Cámara de seguridad,Unidad de Delitos Contra la Propiedad,Sin pistas,Sí,23008,Baja
FELCC-01456,2025-05-07,09:45:05,Robo a comercio,Villa El Carmen,Jose Angel Torrecilla Falcón,58,Femenino,Voluptates aspernatur neque numquam ut. Ipsum magnam labore maxime. Exercitationem impedit veritatis.,Cámara de seguridad,Unidad de Robo de Vehículos,Sin pistas,No,37264,Alta
FELCC-01457,2025-05-07,04:42:51,Robo domiciliario,El Alto 1ra,Fortunato Galindo,66,Masculino,"A recusandae rem id tempore nesciunt laudantium. Recusandae voluptate doloremque. Blanditiis perspiciatis enim odio maiores.
Nam debitis veniam autem sit nemo.",Cámara de seguridad,Unidad de Robo de Vehículos,Derivado a fiscalía,No,32343,Media
FELCC-01458,2025-05-07,08:07:29,Robo a comercio,Miraflores,Ángel del Ballesteros,47,Masculino,Quae nesciunt facilis quod aspernatur eveniet. Quibusdam cupiditate dolore nemo veritatis.,Huella digital,Unidad de Robo de Vehículos,Con detenido,Sí,45121,Media
FELCC-01459,2025-05-07,06:54:27,Robo a mano armada,El Alto 1ra,Eloísa Ramos Vergara,27,Masculino,"Corporis debitis at. Architecto sunt nisi sit labore atque. Saepe perspiciatis doloribus.
Numquam hic voluptates iusto.
Illum magnam alias ad officia.",Reconocimiento visual,Unidad de Robo de Vehículos,Con detenido,No,21787,Media
FELCC-01460,2025-05-07,05:14:19,Robo a mano armada,Zona Sur,Adalberto Caro Uribe,23,Masculino,Iure corrupti deserunt quo aut. Ipsum voluptates quae quibusdam asperiores.,Huella digital,Unidad de Robo de Vehículos,Cerrado,Sí,9272,Baja
FELCC-01461,2025-05-07,01:43:58,Robo domiciliario,Zona Sur,Merche Lozano,47,Femenino,Quos repellat corrupti repellat cum nemo pariatur. Unde minus dolore minus veniam occaecati illum. Possimus quasi eius eius dolore.,Huella digital,Unidad de Delitos Contra la Propiedad,Con detenido,Sí,39824,Alta
FELCC-01462,2025-05-07,18:47:56,Robo a comercio,Zona Sur,Josep Olivé Arrieta,30,Masculino,Ipsam ipsa itaque ea. Et omnis dolores at itaque id eveniet voluptate. Voluptatum doloremque odio eveniet libero facilis.,Huella digital,División Cibercrimen,Derivado a fiscalía,Sí,45865,Alta
FELCC-01463,2025-05-07,00:56:56,Robo a comercio,Centro La Paz,Santiago Paz,51,Femenino,Quasi corrupti fuga magnam voluptatem dolorum eveniet laudantium.,Reconocimiento visual,Unidad de Robo de Vehículos,En investigación,Sí,14384,Baja
FELCC-01464,2025-05-07,09:46:47,Robo a comercio,Zona Sur,Fabián Acuña,61,Femenino,"Aspernatur eaque quae placeat veritatis laudantium at saepe. Nisi dolore laudantium magni eius excepturi magnam iure.
Numquam incidunt nam deleniti illum.",Ninguno,División Cibercrimen,En investigación,Sí,38166,Alta
FELCC-01465,2025-05-07,13:38:59,Robo a mano armada,Zona Sur,Ángeles Valle Merino,53,Masculino,"Voluptas repellat sit doloremque architecto porro. Non repellat optio.
Labore nulla debitis inventore fugit. Non quae dignissimos sapiente quae repellendus voluptatum eum.",Testigos,División Cibercrimen,Con detenido,No,11492,Baja
FELCC-01466,2025-05-07,04:34:22,Robo a mano armada,Centro La Paz,Diego Machado Herranz,48,Masculino,"Esse ipsa accusamus nam dignissimos repellat voluptatum. Eveniet laudantium voluptate nam accusamus saepe dolores.
Aperiam labore cupiditate ipsa voluptate.",Huella digital,División Cibercrimen,Con detenido,No,10631,Baja
FELCC-01467,2025-05-07,03:09:13,Robo a mano armada,Zona Sur,Amarilis Calderón Varela,55,Masculino,Maxime possimus omnis necessitatibus perspiciatis distinctio. Facere suscipit molestias vitae placeat sed.,Reconocimiento visual,Unidad de Robo de Vehículos,Sin pistas,No,10097,Media
FELCC-01468,2025-05-07,17:58:46,Robo a comercio,Sopocachi,Porfirio Iriarte Rebollo,22,Femenino,Labore sunt omnis tempore. Incidunt distinctio nobis magnam officia nulla suscipit. Dignissimos ratione aspernatur aspernatur explicabo.,Huella digital,División Cibercrimen,Sin pistas,Sí,16600,Media
FELCC-01469,2025-05-07,21:10:20,Robo a mano armada,El Alto 1ra,Santos de Acuña,18,Femenino,Quibusdam consequuntur ullam soluta. Soluta inventore officia a nemo quis. Iure consequuntur voluptates aliquam.,Testigos,Unidad de Delitos Contra la Propiedad,Con detenido,Sí,41693,Media
FELCC-01470,2025-05-07,14:49:30,Robo a mano armada,Zona Sur,Rebeca Valenzuela Heras,40,Femenino,Dolorem ut atque quam mollitia. Id deleniti provident laborum sapiente. Blanditiis fugit harum deserunt.,Huella digital,Unidad de Robo de Vehículos,Cerrado,No,31425,Alta
FELCC-01471,2025-05-07,20:12:30,Robo a mano armada,Zona Sur,Candela Mascaró Casas,45,Masculino,"Magni minima nihil velit. Quam sunt officiis non corporis rem sint.
Rem accusamus architecto illo accusamus molestiae. Consequatur hic ullam modi assumenda.",Testigos,Unidad de Delitos Contra la Propiedad,Con detenido,Sí,48984,Media
FELCC-01472,2025-05-07,23:07:09,Robo de vehículo,Zona Sur,Javier Aurelio Padilla Egea,56,Femenino,"Corporis explicabo tenetur.
Consequuntur illo impedit id temporibus delectus nemo. Architecto facilis suscipit nemo.",Testigos,División Cibercrimen,Derivado a fiscalía,No,49660,Baja
FELCC-01473,2025-05-07,23:57:40,Robo domiciliario,Villa El Carmen,Buenaventura Ramírez,66,Femenino,"Ipsum iure nulla ipsam nesciunt voluptatem repellat magnam. Commodi sunt nam qui iusto laboriosam quasi.
Quaerat eligendi perferendis eum eligendi aut.",Testigos,Unidad de Robo de Vehículos,Cerrado,No,35034,Alta
FELCC-01474,2025-05-07,16:59:22,Robo en vía pública,El Alto 1ra,Rosa Hierro Tenorio,34,Masculino,"Ipsa rem accusamus in velit. Ex nemo officiis eveniet.
Praesentium alias voluptatum dolores recusandae.",Reconocimiento visual,Unidad de Delitos Contra la Propiedad,Derivado a fiscalía,Sí,32378,Baja
FELCC-01475,2025-05-07,08:08:01,Robo en vía pública,Villa El Carmen,Gregorio Miranda Roda,18,Femenino,Ipsa deleniti alias fugit. Laudantium repellat cum ipsam dicta dignissimos. Sunt itaque quisquam ipsam eligendi excepturi sequi.,Reconocimiento visual,Unidad de Robo de Vehículos,Derivado a fiscalía,Sí,47324,Baja
FELCC-01476,2025-05-07,18:39:26,Robo domiciliario,Zona Sur,Nidia Fernandez Jaén,39,Femenino,Ea enim explicabo quae maiores. Architecto occaecati nemo delectus. Officiis sint iure illum quas ad sit. Vel dolorem voluptatem ad.,Testigos,Unidad de Delitos Contra la Propiedad,Derivado a fiscalía,No,18086,Media
FELCC-01477,2025-05-07,23:50:18,Robo de vehículo,Villa El Carmen,Guadalupe del Toledo,69,Masculino,Sed quam vitae eveniet dolore voluptatibus. Eum distinctio incidunt. Sapiente fugiat quas quibusdam minima accusamus fugiat deleniti.,Reconocimiento visual,Unidad de Robo de Vehículos,Sin pistas,No,47737,Alta
FELCC-01478,2025-05-07,23:27:23,Robo domiciliario,Miraflores,Javier Andreu-Agudo,47,Femenino,Voluptatem nihil molestiae quos. Pariatur voluptatibus occaecati cupiditate saepe iste quod. Quaerat accusantium ratione vitae. Animi deleniti dolorem quidem nisi sint vel.,Reconocimiento visual,Unidad de Delitos Contra la Propiedad,Sin pistas,No,10624,Media
FELCC-01479,2025-05-07,05:21:31,Robo de vehículo,Zona Sur,Roxana Fuster,61,Masculino,"Quas voluptates ea voluptatem. Iure saepe nobis voluptatem facilis.
Et suscipit quod quibusdam aspernatur adipisci eveniet. Illo ipsa debitis accusantium explicabo.",Testigos,Unidad de Robo de Vehículos,En investigación,No,10903,Alta
FELCC-01480,2025-05-07,14:11:00,Robo en vía pública,Centro La Paz,Artemio Bonilla,62,Femenino,A id ratione ducimus quod fuga. Soluta dolor suscipit.,Reconocimiento visual,Unidad de Robo de Vehículos,Derivado a fiscalía,No,49921,Baja
FELCC-01481,2025-05-07,00:22:25,Robo a comercio,El Alto 1ra,Enrique Reina Sales,45,Femenino,"Reiciendis culpa necessitatibus. Nisi quam repellat sed suscipit. Libero sit rerum perspiciatis atque in ducimus necessitatibus.
Velit recusandae voluptatibus.",Cámara de seguridad,Unidad de Delitos Contra la Propiedad,Con detenido,No,20073,Media
FELCC-01482,2025-05-07,21:55:08,Robo de vehículo,El Alto 1ra,Inocencio Blasco Cazorla,21,Masculino,Ipsam similique accusantium commodi esse. Nemo qui quas eligendi nihil. Aut sint explicabo.,Cámara de seguridad,Unidad de Delitos Contra la Propiedad,Con detenido,No,35190,Alta
FELCC-01483,2025-05-07,15:08:19,Robo domiciliario,Miraflores,Adora Galindo Conesa,55,Masculino,"Occaecati reiciendis id. At reiciendis repellat aliquam mollitia inventore quos deserunt.
Neque minus incidunt magni veniam.",Testigos,Unidad de Robo de Vehículos,Con detenido,No,18796,Baja
FELCC-01484,2025-05-07,02:19:20,Robo de vehículo,Zona Sur,Santos Pinilla Gárate,22,Femenino,Eligendi non possimus voluptates.,Ninguno,División Cibercrimen,Cerrado,No,45344,Baja
FELCC-01485,2025-05-07,02:57:32,Robo en vía pública,Centro La Paz,Elodia Talavera Ponce,74,Femenino,Cumque necessitatibus doloremque magni. Totam excepturi porro facilis. Perferendis reiciendis soluta nobis.,Cámara de seguridad,Unidad de Delitos Contra la Propiedad,Con detenido,No,3076,Media
FELCC-01486,2025-05-07,19:36:29,Robo en vía pública,El Alto 1ra,Sarita Hervás Huguet,42,Femenino,"Alias quod alias non. Ducimus a sequi eos.
Voluptatibus molestiae beatae consequuntur ab possimus ex. Occaecati repellat nobis corrupti modi illo ea.",Testigos,Unidad de Delitos Contra la Propiedad,Cerrado,Sí,14453,Media
FELCC-01487,2025-05-07,21:00:18,Robo a mano armada,Miraflores,Lisandro Pina Coronado,68,Femenino,"Voluptates aut nam illo. Voluptatum rerum iusto.
Natus est ratione rerum inventore unde voluptatem. Temporibus quam asperiores minus magnam facere accusamus sapiente.",Reconocimiento visual,Unidad de Robo de Vehículos,Derivado a fiscalía,Sí,46072,Media
FELCC-01488,2025-05-07,19:03:34,Robo a mano armada,Sopocachi,Rita del Palomar,28,Femenino,"Quaerat nesciunt nobis ullam eligendi quam delectus. In numquam veniam aspernatur deserunt.
Numquam animi autem excepturi. Quas illo repellendus fugiat deserunt sint dolorem.",Huella digital,Unidad de Robo de Vehículos,Sin pistas,Sí,25579,Alta
FELCC-01489,2025-05-07,12:09:32,Robo a mano armada,Villa El Carmen,Emilio Uría Bermúdez,70,Femenino,"Cupiditate asperiores fugit quae ea natus dolore. Ad vero itaque deserunt voluptatibus.
Soluta animi vitae. Dolore repudiandae corrupti.",Ninguno,División Cibercrimen,En investigación,No,4295,Media
FELCC-01490,2025-05-07,22:36:25,Robo a comercio,Sopocachi,Elvira Bárcena Fuentes,60,Femenino,"Nam eos voluptatum. Vero ea occaecati veritatis.
Officiis atque corporis velit. Voluptatibus id at nihil nulla. Libero totam ipsa fuga repudiandae totam hic.",Testigos,División Cibercrimen,Con detenido,No,39242,Baja
FELCC-01491,2025-05-07,07:15:20,Robo domiciliario,El Alto 1ra,Sonia López,56,Masculino,"Odio atque quis esse quas ratione. Corrupti labore facere distinctio inventore dolorum saepe quaerat.
Magni labore voluptas saepe. Error nemo est similique natus.",Testigos,Unidad de Robo de Vehículos,En investigación,Sí,1530,Alta
FELCC-01492,2025-05-07,20:29:14,Robo en vía pública,El Alto 1ra,Amelia Egea Cañete,36,Femenino,"Similique incidunt ipsa laboriosam. Labore impedit facilis accusantium beatae nostrum.
Facere harum molestiae id delectus facere nulla.",Reconocimiento visual,Unidad de Robo de Vehículos,En investigación,Sí,12395,Baja
FELCC-01493,2025-05-07,23:52:07,Robo a comercio,Zona Sur,Eustaquio de Arregui,50,Femenino,Occaecati molestiae et eum ipsa dolor. Debitis aut aliquid rerum nemo eligendi. Eaque doloremque dignissimos exercitationem at voluptatibus doloribus earum.,Reconocimiento visual,División Cibercrimen,En investigación,No,46227,Media
FELCC-01494,2025-05-07,02:41:53,Robo en vía pública,Sopocachi,Eufemia Carreño Iriarte,53,Masculino,Alias nulla ullam aspernatur corporis. Porro accusantium amet necessitatibus rem quis quam quibusdam.,Ninguno,Unidad de Delitos Contra la Propiedad,Sin pistas,No,22957,Media
FELCC-01495,2025-05-07,04:05:58,Robo a mano armada,Zona Sur,Cecilio Ambrosio Morell Armas,37,Masculino,Non voluptas accusantium ea sapiente consequuntur ipsa quasi. Hic voluptatibus quod. Voluptatem aliquam neque sit.,Cámara de seguridad,Unidad de Robo de Vehículos,Cerrado,Sí,4131,Alta
FELCC-01496,2025-05-07,06:01:46,Robo a comercio,Centro La Paz,Ariel Casas Navarro,49,Masculino,Ratione nobis debitis eos officiis expedita eos. Eos vel occaecati voluptatem nemo eveniet.,Huella digital,División Cibercrimen,Con detenido,No,11462,Baja
FELCC-01497,2025-05-07,05:19:18,Robo domiciliario,Villa El Carmen,Elías Diéguez Espejo,23,Masculino,Sint numquam aliquam iure a. Molestias ab maxime. Rem fugit enim odio minima.,Cámara de seguridad,División Cibercrimen,Derivado a fiscalía,No,38338,Media
FELCC-01498,2025-05-07,17:18:16,Robo en vía pública,Villa El Carmen,Roxana Puga Roca,54,Femenino,Harum dicta aut tempora optio quibusdam deleniti. Exercitationem eaque aliquid molestiae rerum perspiciatis consequatur. Tempora velit voluptas in.,Huella digital,Unidad de Robo de Vehículos,Con detenido,Sí,25971,Alta
FELCC-01499,2025-05-07,10:20:33,Robo de vehículo,Sopocachi,Teo Prada Galán,68,Masculino,Consequuntur eveniet provident ipsum. Nisi itaque quam corrupti harum odio voluptates sit.,Reconocimiento visual,Unidad de Robo de Vehículos,Sin pistas,Sí,31791,Alta
FELCC-01500,2025-05-07,11:03:53,Robo a mano armada,Villa El Carmen,Sarita Guzman Belda,27,Femenino,"Natus laborum aperiam illo unde. Facere corporis amet culpa.
Laborum quam corporis odio at molestias. Magnam distinctio nisi dolorum officia illum.",Testigos,Unidad de Delitos Contra la Propiedad,Derivado a fiscalía,No,45420,Alta
FELCC-01501,2025-05-07,06:54:58,Robo domiciliario,Villa El Carmen,Tatiana Montserrat Riba,22,Masculino,Maiores at totam fuga earum. Corrupti commodi asperiores quaerat possimus tempora earum debitis.,Ninguno,Unidad de Delitos Contra la Propiedad,Con detenido,No,36607,Baja
FELCC-01502,2025-05-07,20:33:13,Robo domiciliario,El Alto 1ra,Tere Ruiz Fajardo,72,Masculino,"Fugit quia cumque voluptatum.
Possimus itaque incidunt exercitationem deleniti. Tenetur asperiores repellat vel dignissimos.",Huella digital,Unidad de Robo de Vehículos,En investigación,Sí,16428,Baja
FELCC-01503,2025-05-07,07:04:16,Robo a mano armada,Centro La Paz,Marcela Gascón Quintanilla,27,Femenino,Necessitatibus accusamus totam enim aliquam. Quod facilis cumque laudantium labore hic temporibus.,Cámara de seguridad,Unidad de Delitos Contra la Propiedad,Cerrado,No,42150,Media
FELCC-01504,2025-05-07,18:57:29,Robo de vehículo,Villa El Carmen,Dani Medina Tur,59,Femenino,Laudantium culpa laborum excepturi. Perferendis iure alias repellat fugiat natus.,Ninguno,Unidad de Robo de Vehículos,En investigación,No,12870,Alta
FELCC-01505,2025-05-07,15:05:26,Robo en vía pública,Villa El Carmen,Agustina Terrón Sanmartín,68,Masculino,Error vero perspiciatis asperiores repudiandae architecto nesciunt maxime. Quisquam alias placeat autem. Quo ipsam iste vero.,Reconocimiento visual,Unidad de Robo de Vehículos,Cerrado,No,19937,Baja
FELCC-01506,2025-05-07,06:33:52,Robo a mano armada,Centro La Paz,Candelario Egea Vallés,64,Femenino,Cum quod recusandae quibusdam. Laborum nesciunt voluptas animi illo repellat iste.,Ninguno,División Cibercrimen,Con detenido,Sí,37293,Baja
FELCC-01507,2025-05-07,20:06:51,Robo a comercio,Zona Sur,Dafne Ribes-Quiroga,57,Femenino,Explicabo quasi iste beatae beatae. Sunt harum quas alias ad repudiandae molestias ab.,Cámara de seguridad,Unidad de Robo de Vehículos,Con detenido,No,37038,Alta
FELCC-01508,2025-05-07,19:31:24,Robo a comercio,Miraflores,Zaida Santana,28,Masculino,"Perferendis assumenda minima possimus. Iste neque et. Porro sit natus molestias.
Cupiditate id unde quas voluptates sunt.",Testigos,Unidad de Delitos Contra la Propiedad,Derivado a fiscalía,No,14714,Alta
FELCC-01509,2025-05-07,00:43:52,Robo a comercio,Centro La Paz,Pío Peiró Oliveras,34,Masculino,Assumenda ratione iusto assumenda praesentium. Eligendi laboriosam inventore cupiditate.,Testigos,Unidad de Robo de Vehículos,Sin pistas,Sí,28720,Alta
FELCC-01510,2025-05-07,12:11:54,Robo a comercio,El Alto 1ra,Jesús Isern Cano,37,Femenino,"Sed fugit reprehenderit aspernatur eligendi fuga.
Expedita iure quod mollitia beatae possimus. Aut dolorum maxime iure a eum blanditiis adipisci.",Ninguno,Unidad de Robo de Vehículos,Cerrado,Sí,4047,Media
FELCC-01511,2025-05-07,11:29:54,Robo a comercio,Centro La Paz,Luz Maestre Barriga,56,Masculino,Illo molestiae enim esse necessitatibus illo vero. Dolorum cupiditate quisquam id ut deserunt. Fugit deleniti at nobis.,Cámara de seguridad,Unidad de Delitos Contra la Propiedad,Cerrado,Sí,37711,Baja
FELCC-01512,2025-05-07,05:50:35,Robo domiciliario,Sopocachi,Cayetano Velázquez Pacheco,33,Femenino,Consectetur error molestiae doloribus deleniti nisi. Quibusdam ducimus illo quas modi porro.,Cámara de seguridad,División Cibercrimen,Sin pistas,No,32678,Alta
FELCC-01513,2025-05-07,07:12:34,Robo en vía pública,Centro La Paz,Sonia Palma Sanchez,53,Masculino,Ipsa debitis asperiores assumenda molestiae esse architecto.,Reconocimiento visual,Unidad de Robo de Vehículos,En investigación,No,2953,Alta
FELCC-01514,2025-05-07,02:14:51,Robo a comercio,Villa El Carmen,Emelina Rosselló-Pavón,31,Masculino,Consectetur voluptatum suscipit exercitationem culpa. Repudiandae alias aliquid culpa.,Reconocimiento visual,División Cibercrimen,En investigación,No,40007,Baja
FELCC-01515,2025-05-07,19:34:15,Robo a mano armada,Zona Sur,Leandro Porras-Pelayo,33,Femenino,Perferendis expedita esse mollitia adipisci a. Deserunt qui quidem quae in rem. Minima illo hic optio delectus.,Ninguno,División Cibercrimen,Sin pistas,Sí,44105,Alta
FELCC-01516,2025-05-07,12:09:33,Robo a comercio,Zona Sur,Rosalía Luque,29,Femenino,"Reiciendis fugit adipisci voluptatem. Voluptates veritatis odio maiores eos sapiente suscipit.
Autem voluptatum iure consequatur.",Huella digital,División Cibercrimen,Sin pistas,No,47717,Alta
FELCC-01517,2025-05-07,05:01:01,Robo a mano armada,Villa El Carmen,Carolina Ribas Menendez,21,Femenino,Provident excepturi amet libero accusamus autem rerum. Excepturi corporis dicta modi nisi dolore nesciunt earum.,Ninguno,División Cibercrimen,Cerrado,No,24306,Alta
FELCC-01518,2025-05-07,23:42:54,Robo en vía pública,Zona Sur,Geraldo Angulo Seguí,57,Masculino,Autem ratione porro ratione. Corrupti eaque velit ut deserunt animi nisi. Laboriosam sit officiis dolor veniam. Necessitatibus vitae modi ipsam soluta praesentium.,Testigos,Unidad de Delitos Contra la Propiedad,Sin pistas,Sí,43526,Media
FELCC-01519,2025-05-07,22:03:43,Robo en vía pública,El Alto 1ra,Victor Manuel Gaya-Molins,34,Femenino,Est minus sapiente et. Error itaque reprehenderit esse nemo fugit. Tempore illum laborum dolorem deserunt cum officiis. Atque libero corrupti sit expedita ipsam architecto.,Reconocimiento visual,División Cibercrimen,Cerrado,No,47619,Baja
FELCC-01520,2025-05-07,20:05:58,Robo domiciliario,Miraflores,Jennifer Selena Machado Aragón,49,Femenino,"Autem id officiis impedit deleniti laboriosam. Iure nobis laboriosam. Excepturi vel vero reprehenderit.
Aliquam odit saepe quisquam in quod. Nesciunt facere placeat quasi soluta.",Huella digital,Unidad de Robo de Vehículos,En investigación,No,19073,Media
FELCC-01521,2025-05-07,08:46:02,Robo a comercio,Centro La Paz,Eugenio Morales Calderon,26,Femenino,"Dicta ab saepe iste minima voluptas.
Explicabo hic aliquid culpa voluptatibus voluptatem eaque ut. Sint repellendus voluptatem voluptatem. Tempore rem repellendus.",Testigos,Unidad de Delitos Contra la Propiedad,Cerrado,Sí,44435,Alta
FELCC-01522,2025-05-07,05:13:47,Robo a mano armada,Zona Sur,Jordán Blanco Santamaría,41,Femenino,Hic consectetur fugit. Repellat in ullam beatae accusantium enim eaque. Nam asperiores quaerat voluptates iste.,Ninguno,Unidad de Robo de Vehículos,Con detenido,No,21392,Alta
FELCC-01523,2025-05-07,16:08:31,Robo en vía pública,El Alto 1ra,Lino Cuenca Barroso,69,Masculino,"Mollitia sint ipsum animi. Quibusdam est assumenda ipsam.
Expedita enim quia velit assumenda laboriosam. Nulla maiores facilis ut magni quibusdam incidunt.",Cámara de seguridad,Unidad de Delitos Contra la Propiedad,Derivado a fiscalía,No,32173,Media
FELCC-01524,2025-05-07,00:09:49,Robo a mano armada,Sopocachi,Conrado García-Gelabert,30,Masculino,Minima doloremque ipsam earum enim sequi. Facere labore laborum placeat. Tempora eligendi laudantium.,Huella digital,Unidad de Delitos Contra la Propiedad,Sin pistas,No,35804,Alta
FELCC-01525,2025-05-07,17:04:52,Robo domiciliario,Villa El Carmen,Mario Duque,22,Femenino,Quibusdam a temporibus suscipit omnis perferendis voluptatem. Delectus illo quaerat exercitationem eius architecto aliquid. Veritatis perferendis eligendi commodi.,Ninguno,Unidad de Robo de Vehículos,Con detenido,No,23087,Media
FELCC-01526,2025-05-07,02:15:53,Robo a comercio,Zona Sur,Oriana Vilalta Giner,51,Femenino,Architecto libero ex consequuntur ab fugiat. Dolorum mollitia veniam similique nihil natus.,Cámara de seguridad,Unidad de Delitos Contra la Propiedad,Sin pistas,Sí,47363,Alta
FELCC-01527,2025-05-07,05:06:06,Robo a comercio,Zona Sur,Ildefonso Torrents Goñi,18,Masculino,"Officia sapiente nulla ducimus quaerat. Quod maxime ducimus illum.
Voluptates dolore culpa dicta mollitia culpa quibusdam adipisci. Esse ad vel sint perferendis.",Cámara de seguridad,División Cibercrimen,Derivado a fiscalía,Sí,47681,Media
FELCC-01528,2025-05-07,06:07:44,Robo domiciliario,Villa El Carmen,Azahara de Amigó,66,Femenino,"Facilis enim veniam id.
Nostrum dolor autem. Possimus adipisci asperiores temporibus magni. Explicabo officia mollitia quo accusantium ad amet.",Reconocimiento visual,Unidad de Delitos Contra la Propiedad,Con detenido,No,38077,Alta
FELCC-01529,2025-05-07,02:37:54,Robo de vehículo,Villa El Carmen,Evelia Otero Casanovas,52,Femenino,"Deserunt esse repellendus sapiente ipsam. Atque aperiam nobis totam. Excepturi velit rem veniam.
Deleniti recusandae ex veniam minima commodi. Libero sequi veniam sunt.",Huella digital,Unidad de Robo de Vehículos,Sin pistas,Sí,21870,Baja
FELCC-01530,2025-05-07,17:11:05,Robo domiciliario,Zona Sur,Gervasio Corral-Luz,56,Femenino,Officiis consectetur laudantium minus sint ipsa. Assumenda sequi provident sunt nisi dicta numquam dolor. Delectus earum earum corrupti minima modi quia.,Ninguno,Unidad de Delitos Contra la Propiedad,Con detenido,No,5607,Media
FELCC-01531,2025-05-07,17:11:49,Robo domiciliario,Miraflores,Berta Serna Ferrán,63,Femenino,Architecto provident ratione deserunt id commodi. Asperiores voluptas consequatur natus quibusdam sequi officiis. Aut assumenda eos. Minus nemo delectus non corrupti.,Reconocimiento visual,Unidad de Robo de Vehículos,Cerrado,No,6453,Media
FELCC-01532,2025-05-07,22:57:55,Robo a comercio,Zona Sur,María Pilar Hervia-Rodrigo,32,Femenino,"Voluptatem odit reiciendis. Quos laboriosam laudantium labore provident numquam.
Rem eveniet nemo adipisci magni. Ut aliquid ipsum ex consequatur. Laborum rem voluptatem nisi.",Reconocimiento visual,Unidad de Delitos Contra la Propiedad,Sin pistas,No,45852,Baja
FELCC-01533,2025-05-07,08:46:52,Robo a comercio,Centro La Paz,Josefina Barberá Novoa,29,Femenino,"Consectetur hic eos voluptatibus incidunt. Soluta molestias mollitia ut totam.
Nesciunt nulla eius. Ab neque similique et.",Huella digital,División Cibercrimen,Con detenido,No,29118,Media
FELCC-01534,2025-05-07,11:56:03,Robo domiciliario,Sopocachi,Celso Lopez Solana,69,Masculino,"Consequuntur consequatur hic ea perspiciatis. Sint repudiandae a fuga voluptates.
Cupiditate reprehenderit sint earum. Dolor eveniet rerum cum.",Testigos,Unidad de Robo de Vehículos,Con detenido,No,45722,Media
FELCC-01535,2025-05-07,23:09:13,Robo de vehículo,Miraflores,Florencio Malo Ortuño,22,Femenino,Minus exercitationem dolor nemo sunt. Rerum eaque eum ipsa quos ad.,Ninguno,Unidad de Delitos Contra la Propiedad,En investigación,No,15053,Alta
FELCC-01536,2025-05-07,04:18:24,Robo domiciliario,Miraflores,Modesto Luz Galán,20,Masculino,"Neque architecto sed molestias. Exercitationem minus deleniti suscipit.
Corporis omnis facilis numquam sint. Vero sit sunt nemo voluptatem dolore.",Cámara de seguridad,División Cibercrimen,Cerrado,No,41942,Alta
FELCC-01537,2025-05-07,12:32:56,Robo a mano armada,Zona Sur,Lázaro Sanabria Peláez,46,Femenino,Quaerat labore similique autem dicta. Praesentium voluptatem cum quibusdam aliquid quae et exercitationem.,Ninguno,Unidad de Delitos Contra la Propiedad,Cerrado,Sí,30338,Alta
FELCC-01538,2025-05-07,23:48:13,Robo de vehículo,Villa El Carmen,Ramona Ferrera Ledesma,50,Masculino,Sapiente amet voluptas inventore quia dolorum dicta. Excepturi vel molestiae commodi facilis. Reprehenderit molestiae fugit a qui iure eum.,Testigos,División Cibercrimen,En investigación,No,30103,Baja
FELCC-01539,2025-05-07,22:35:36,Robo en vía pública,Miraflores,Agustina Pulido Borrás,45,Femenino,"Libero harum iure. Deserunt sapiente esse.
Error sint dolorem sit architecto. Minima accusantium culpa aliquam ipsa.",Reconocimiento visual,División Cibercrimen,En investigación,Sí,14697,Alta
FELCC-01540,2025-05-07,02:01:58,Robo a mano armada,Miraflores,Lourdes Luciana Guerra Valencia,57,Masculino,"Labore porro maiores sequi perferendis. Rerum praesentium explicabo iste labore quod. Provident incidunt dicta vitae expedita quam.
Voluptates magni tempora ex corporis vel natus.",Testigos,División Cibercrimen,Con detenido,No,33792,Media
